{
  "schema_version": "2.0",
  "artifact_type": "goal_gate",
  "project_id": "coar-demo",
  "created_at": "2026-07-14T12:00:00Z",
  "updated_at": "2026-07-14T12:00:00Z",
  "extensions": {},
  "trial_id": "000001_test-main-signal",
  "status": "continue",
  "decision_rule": "viable_path and concrete_high_value_move",
  "reasons": [
    "A high-value replication trial remains."
  ],
  "response_to_human": null,
  "next_move": {
    "target": "evaluation",
    "move": "test",
    "question": "Does the result replicate across seeds?",
    "expected_value": "high"
  },
  "canonical_revision": 1,
  "review_level": "standard",
  "all_required_reviewers_pass": true
}
